{
  "id": "natal.ming-yin-metal-four.day-one.1987",
  "contractVersion": "v1",
  "scenario": "construct-chart",
  "input": {
    "kind": "Birth",
    "gender": "Female",
    "birthYear": 1987,
    "birthMonth": 1,
    "birthDay": 1,
    "birthHour": "Zi"
  },
  "expected": {
    "yearPillar": { "stem": "Ding", "branch": "Mao" },
    "fiveElementBureau": "MetalFour",
    "mingBranch": "Yin",
    "shenBranch": "Yin",
    "originBranch": "Wei",
    "ziweiBranch": "Hai",
    "tianfuBranch": "Si"
  },
  "queries": [
    { "kind": "star-branch", "star": "ZiWei", "expectedBranch": "Hai" },
    { "kind": "star-branch", "star": "TianFu", "expectedBranch": "Si" }
  ],
  "provenance": {
    "sources": [
      { "path": "../../crates/ziwei/tests/fixtures/README.md", "section": "五行局与出生日边界锚点" },
      { "path": "../../CONTEXT.md", "section": "核心不变量" },
      { "path": "../../docs/architecture/v1-decision-map.md", "section": "D-214～D-224" }
    ],
    "derivation": "固定锚点取 1987 年女命正月子时，命身均在寅；丁年五虎遁得壬寅命宫，为金四局。初一除以四，商一、补数三，按寅退三至亥安紫微；天府以寅申轴对称在巳。丁干来因宫映射为未。"
  },
  "evidence": { "independentOfImplementationOutput": true, "externalReview": "not-reviewed" }
}
