{
  "id": "natal.ming-yin-wood-three.day-one.1986",
  "contractVersion": "v1",
  "scenario": "construct-chart",
  "input": {
    "kind": "Birth",
    "gender": "Female",
    "birthYear": 1986,
    "birthMonth": 1,
    "birthDay": 1,
    "birthHour": "Zi"
  },
  "expected": {
    "yearPillar": { "stem": "Bing", "branch": "Yin" },
    "fiveElementBureau": "WoodThree",
    "mingBranch": "Yin",
    "shenBranch": "Yin",
    "originBranch": "Shen",
    "ziweiBranch": "Chen",
    "tianfuBranch": "Zi"
  },
  "queries": [
    { "kind": "star-branch", "star": "ZiWei", "expectedBranch": "Chen" },
    { "kind": "star-branch", "star": "TianFu", "expectedBranch": "Zi" }
  ],
  "provenance": {
    "sources": [
      { "path": "../../crates/ziwei/tests/fixtures/README.md", "section": "五行局与出生日边界锚点" },
      { "path": "../../CONTEXT.md", "section": "核心不变量" },
      { "path": "../../docs/architecture/v1-decision-map.md", "section": "D-214～D-224" }
    ],
    "derivation": "固定锚点取 1986 年女命正月子时，命身均在寅；丙年五虎遁得庚寅命宫，为木三局。初一除以三，商一、补数二，按寅进二至辰安紫微；天府以寅申轴对称在子。丙干来因宫映射为申。"
  },
  "evidence": { "independentOfImplementationOutput": true, "externalReview": "not-reviewed" }
}
