{
  "id": "natal.ming-yin-earth-five.day-one.1985",
  "contractVersion": "v1",
  "scenario": "construct-chart",
  "input": {
    "kind": "Birth",
    "gender": "Female",
    "birthYear": 1985,
    "birthMonth": 1,
    "birthDay": 1,
    "birthHour": "Zi"
  },
  "expected": {
    "yearPillar": { "stem": "Yi", "branch": "Chou" },
    "fiveElementBureau": "EarthFive",
    "mingBranch": "Yin",
    "shenBranch": "Yin",
    "originBranch": "You",
    "ziweiBranch": "Wu",
    "tianfuBranch": "Xu"
  },
  "queries": [
    { "kind": "star-branch", "star": "ZiWei", "expectedBranch": "Wu" },
    { "kind": "star-branch", "star": "TianFu", "expectedBranch": "Xu" }
  ],
  "provenance": {
    "sources": [
      { "path": "../../crates/ziwei/tests/fixtures/README.md", "section": "五行局与出生日边界锚点" },
      { "path": "../../CONTEXT.md", "section": "核心不变量" },
      { "path": "../../docs/architecture/v1-decision-map.md", "section": "D-214～D-224" }
    ],
    "derivation": "固定锚点取 1985 年女命正月子时，命身均在寅；乙年五虎遁得戊寅命宫，为土五局。初一除以五，商一、补数四，按寅进四至午安紫微；天府以寅申轴对称在戌。乙干来因宫映射为酉。"
  },
  "evidence": { "independentOfImplementationOutput": true, "externalReview": "not-reviewed" }
}
